timestamp,session_id,event_type,user_query,matched_id,similarity_score,bot_reply,total_points,badge,extra
2026-02-28T16:12:28.227618,54e15bc2-e1b5-4b1d-9ea9-ddf9bb90e333,chat,hi,,0.0,"Sorry, I could not find a suitable answer. Please try another keyword such as opening hours, facilities, mini hydropower, turbine, generator, or quiz.",0,New Visitor,fallback
2026-02-28T16:12:34.920302,54e15bc2-e1b5-4b1d-9ea9-ddf9bb90e333,chat,turbine,M003,0.5449,The turbine converts the energy of flowing water into rotational mechanical energy.,10,New Visitor,similarity
2026-02-28T16:12:38.502881,54e15bc2-e1b5-4b1d-9ea9-ddf9bb90e333,chat,hydropower,M005,1.0,"Mini hydropower output is mainly affected by water flow rate, water head, and the efficiency of the turbine-generator system.",25,New Visitor,keyword
2026-02-28T16:12:42.706675,54e15bc2-e1b5-4b1d-9ea9-ddf9bb90e333,chat,hydro,,0.0,"Sorry, I could not find a suitable answer. Please try another keyword such as opening hours, facilities, mini hydropower, turbine, generator, or quiz.",25,New Visitor,fallback
2026-03-01T17:09:53.179637,b1601932-88d0-4735-9c99-f59f11f0ab2e,chat,what is hte main energy source in mini hydrapower,M001,0.3556,Mini hydropower is a small-scale system that uses flowing water to generate electricity.,10,New Visitor,similarity
2026-03-01T17:10:06.182784,b1601932-88d0-4735-9c99-f59f11f0ab2e,quiz,What is the main energy source in mini hydropower?,Q01,1.0,Selected: Flowing water | Correct: Flowing water,30,Explorer Beginner,Mini hydropower uses the energy of flowing water to produce electricity.
2026-03-01T17:10:13.849015,b1601932-88d0-4735-9c99-f59f11f0ab2e,quiz,Which component rotates because of water flow?,Q02,1.0,Selected: Turbine | Correct: Turbine,50,Explorer Beginner,The turbine rotates when driven by flowing water.
2026-03-01T17:10:22.579272,b1601932-88d0-4735-9c99-f59f11f0ab2e,chat,What is the function of a generator in mini hydropower?,M004,0.6932,The generator converts the turbine's rotational energy into electrical energy.,60,Energy Explorer,similarity
2026-03-01T17:10:37.435216,b1601932-88d0-4735-9c99-f59f11f0ab2e,quiz,What is the function of a generator in mini hydropower?,Q03,1.0,Selected: To convert mechanical energy into electricity | Correct: To convert mechanical energy into electricity,80,Energy Explorer,The generator converts rotational mechanical energy into electrical energy.
2026-03-01T17:10:46.109610,b1601932-88d0-4735-9c99-f59f11f0ab2e,quiz,Which factor strongly affects mini hydropower output?,Q04,1.0,Selected: Flow rate | Correct: Flow rate,100,Mini Hydropower Ambassador,Flow rate is one of the main factors affecting the power output of mini hydropower.
2026-03-01T17:10:52.931284,b1601932-88d0-4735-9c99-f59f11f0ab2e,quiz,Why is mini hydropower considered renewable energy?,Q05,1.0,Selected: Because it uses flowing water | Correct: Because it uses flowing water,120,Mini Hydropower Ambassador,"Mini hydropower relies on the natural movement of water, which is a renewable source."
2026-03-01T17:11:02.205139,b1601932-88d0-4735-9c99-f59f11f0ab2e,quiz,What should visitors do near technical equipment?,Q06,1.0,Selected: Stay away unless permitted | Correct: Stay away unless permitted,140,Mini Hydropower Ambassador,Visitors should keep a safe distance from technical equipment unless guided by staff.
2026-03-01T17:11:34.441030,b1601932-88d0-4735-9c99-f59f11f0ab2e,quiz,Mini hydropower is usually designed for ...,Q07,1.0,Selected: Local or small-scale electricity needs | Correct: Local or small-scale electricity needs,160,Mini Hydropower Ambassador,Mini hydropower is commonly used for local and small-scale electricity generation.
2026-03-01T17:11:41.603307,b1601932-88d0-4735-9c99-f59f11f0ab2e,quiz,What makes this tourism site educational?,Q08,1.0,Selected: It combines nature with mini hydropower learning | Correct: It combines nature with mini hydropower learning,180,Mini Hydropower Ambassador,The site supports learning because visitors can see renewable energy concepts in a real natural setting.
2026-03-01T17:11:53.412567,b1601932-88d0-4735-9c99-f59f11f0ab2e,quiz,What is one benefit of gamification in this chatbot?,Q09,1.0,Selected: It can increase engagement and motivation | Correct: It can increase engagement and motivation,200,Mini Hydropower Ambassador,"Points, badges, and quizzes help keep users engaged and interested in learning."
2026-03-01T17:12:01.113405,b1601932-88d0-4735-9c99-f59f11f0ab2e,quiz,How can visitors help protect the tourism site?,Q10,1.0,Selected: By keeping the area clean and following rules | Correct: By keeping the area clean and following rules,220,Mini Hydropower Ambassador,Responsible visitor behavior helps protect both the environment and the learning facilities.
2026-03-01T17:12:52.909053,b1601932-88d0-4735-9c99-f59f11f0ab2e,quiz,What is the main energy source in mini hydropower?,Q01,1.0,Selected: Flowing water | Correct: Flowing water,20,New Visitor,Mini hydropower uses the energy of flowing water to produce electricity.
2026-03-01T17:13:00.417344,b1601932-88d0-4735-9c99-f59f11f0ab2e,quiz,Which component rotates because of water flow?,Q02,1.0,Selected: Turbine | Correct: Turbine,40,Explorer Beginner,The turbine rotates when driven by flowing water.
2026-03-01T17:13:06.195929,b1601932-88d0-4735-9c99-f59f11f0ab2e,quiz,What is the function of a generator in mini hydropower?,Q03,1.0,Selected: To convert mechanical energy into electricity | Correct: To convert mechanical energy into electricity,60,Energy Explorer,The generator converts rotational mechanical energy into electrical energy.
2026-03-01T17:13:11.081078,b1601932-88d0-4735-9c99-f59f11f0ab2e,quiz,Which factor strongly affects mini hydropower output?,Q04,1.0,Selected: Flow rate | Correct: Flow rate,80,Energy Explorer,Flow rate is one of the main factors affecting the power output of mini hydropower.
2026-03-01T17:13:15.730307,b1601932-88d0-4735-9c99-f59f11f0ab2e,quiz,Why is mini hydropower considered renewable energy?,Q05,1.0,Selected: Because it uses flowing water | Correct: Because it uses flowing water,100,Mini Hydropower Ambassador,"Mini hydropower relies on the natural movement of water, which is a renewable source."
2026-03-01T17:13:22.059122,b1601932-88d0-4735-9c99-f59f11f0ab2e,quiz,What should visitors do near technical equipment?,Q06,1.0,Selected: Stay away unless permitted | Correct: Stay away unless permitted,120,Mini Hydropower Ambassador,Visitors should keep a safe distance from technical equipment unless guided by staff.
2026-03-01T17:13:32.821903,b1601932-88d0-4735-9c99-f59f11f0ab2e,quiz,Mini hydropower is usually designed for ...,Q07,1.0,Selected: Local or small-scale electricity needs | Correct: Local or small-scale electricity needs,140,Mini Hydropower Ambassador,Mini hydropower is commonly used for local and small-scale electricity generation.
2026-03-01T17:13:39.814867,b1601932-88d0-4735-9c99-f59f11f0ab2e,quiz,What makes this tourism site educational?,Q08,1.0,Selected: It combines nature with mini hydropower learning | Correct: It combines nature with mini hydropower learning,160,Mini Hydropower Ambassador,The site supports learning because visitors can see renewable energy concepts in a real natural setting.
2026-03-01T17:13:44.740444,b1601932-88d0-4735-9c99-f59f11f0ab2e,quiz,What is one benefit of gamification in this chatbot?,Q09,1.0,Selected: It can increase engagement and motivation | Correct: It can increase engagement and motivation,180,Mini Hydropower Ambassador,"Points, badges, and quizzes help keep users engaged and interested in learning."
2026-03-01T17:13:48.226471,b1601932-88d0-4735-9c99-f59f11f0ab2e,quiz,How can visitors help protect the tourism site?,Q10,1.0,Selected: By keeping the area clean and following rules | Correct: By keeping the area clean and following rules,200,Mini Hydropower Ambassador,Responsible visitor behavior helps protect both the environment and the learning facilities.
2026-03-01T17:14:07.971955,b1601932-88d0-4735-9c99-f59f11f0ab2e,chat,apa itu mini hydropower,M001,0.4323,Mini hydropower is a small-scale system that uses flowing water to generate electricity.,210,Mini Hydropower Ambassador,similarity
2026-03-01T17:17:45.463331,39cd0ce4-c263-4154-a53d-62630276816a,chat,apa itu pltmh,,0.0,"Sorry, I could not find a suitable answer. Please try another keyword such as opening hours, facilities, mini hydropower, turbine, generator, or quiz.",0,New Visitor,fallback
2026-03-01T17:18:06.774324,39cd0ce4-c263-4154-a53d-62630276816a,chat,PLTMH,,0.0,"Sorry, I could not find a suitable answer. Please try another keyword such as opening hours, facilities, mini hydropower, turbine, generator, or quiz.",0,New Visitor,fallback
2026-03-01T17:22:31.864478,9ecc5aee-e629-4f8c-a2ef-e153ef2ed0e0,chat,Apa sumber energi utama pada PLTMH (Pembangkit Listrik Tenaga Mikro Hidro)?,M001,0.7454, PLTMH adalah sistem pembangkit listrik berskala kecil yang menggunakan aliran air untuk menghasilkan listrik.,10,New Visitor,similarity
2026-03-01T17:22:43.684995,9ecc5aee-e629-4f8c-a2ef-e153ef2ed0e0,chat,buka nya kapan?,W001,0.4892,Tempat wisata ini buka setiap hari dari pukul 08:00 hingga 17:00. Jam operasional dapat berubah pada hari libur nasional atau saat cuaca buruk.,15,New Visitor,similarity
2026-03-01T17:22:49.616052,9ecc5aee-e629-4f8c-a2ef-e153ef2ed0e0,chat,bukanya kapan,W001,1.0,Tempat wisata ini buka setiap hari dari pukul 08:00 hingga 17:00. Jam operasional dapat berubah pada hari libur nasional atau saat cuaca buruk.,15,New Visitor,keyword
2026-03-01T17:22:57.834711,9ecc5aee-e629-4f8c-a2ef-e153ef2ed0e0,chat,lokasi dimana,,0.0,"Sorry, I could not find a suitable answer. Please try another keyword such as opening hours, facilities, mini hydropower, turbine, generator, or quiz.",15,New Visitor,fallback
2026-03-01T17:23:36.861648,9ecc5aee-e629-4f8c-a2ef-e153ef2ed0e0,chat,apa itu mhp,M001,0.4182, PLTMH adalah sistem pembangkit listrik berskala kecil yang menggunakan aliran air untuk menghasilkan listrik.,15,New Visitor,similarity
2026-03-01T17:30:11.601073,9ecc5aee-e629-4f8c-a2ef-e153ef2ed0e0,chat,beritahu saya gunanya mhp ini apa ,,0.0,"Sorry, I could not find a suitable answer. Please try another keyword such as opening hours, facilities, mini hydropower, turbine, generator, or quiz.",15,New Visitor,fallback
2026-03-01T17:32:31.489989,9ecc5aee-e629-4f8c-a2ef-e153ef2ed0e0,chat,halo disana,,0.0,"Sorry, I could not find a suitable answer. Please try another keyword such as opening hours, facilities, mini hydropower, turbine, generator, or quiz.",15,New Visitor,fallback
2026-03-01T17:33:05.569779,9ecc5aee-e629-4f8c-a2ef-e153ef2ed0e0,chat,halo disana,,0.0,"Maaf, saya tidak dapat menemukan jawaban yang sesuai. Silakan coba kata kunci lain seperti jam buka, fasilitas, PLTMH, turbin, generator, atau kuis.",15,New Visitor,fallback
2026-03-01T17:33:21.548375,9ecc5aee-e629-4f8c-a2ef-e153ef2ed0e0,chat,Aturan keselamatan apa yang harus diikuti pengunjung?,W003,0.738,"Pengunjung harus menghindari area yang licin, menjauh dari peralatan teknis tanpa izin, dan mematuhi rambu-rambu serta instruksi staf setiap saat.",25,New Visitor,similarity
2026-03-01T17:41:06.826684,49d28cf7-c4f5-461e-849f-023a01e10bb4,chat,apa itu pltmh,M001,0.5535, PLTMH adalah sistem pembangkit listrik berskala kecil yang menggunakan aliran air untuk menghasilkan listrik.,10,New Visitor,similarity
2026-03-01T17:41:15.064146,49d28cf7-c4f5-461e-849f-023a01e10bb4,chat,berikan jawaban lain ,,0.0,"Maaf, saya tidak dapat menemukan jawaban yang sesuai. Silakan coba kata kunci lain seperti jam buka, fasilitas, PLTMH, turbin, generator, atau kuis.",10,New Visitor,fallback
2026-03-01T17:41:23.395999,49d28cf7-c4f5-461e-849f-023a01e10bb4,chat,saya ingin bertanya jam buka nya kapan,W001,0.5707,Tempat wisata ini buka setiap hari dari pukul 08:00 hingga 17:00. Jam operasional dapat berubah pada hari libur nasional atau saat cuaca buruk.,15,New Visitor,similarity
2026-03-02T19:53:58.021948,1f2b21ed-5121-4c0e-8ae4-138aa2f5d726,quiz,Apa sumber energi utama dalam mini hydropower?,Q01,1.0,Dipilih: Air mengalir | Benar: Air mengalir,20,New Visitor,Mini hydropower menggunakan energi dari air yang mengalir untuk menghasilkan listrik.
2026-03-02T19:54:00.888473,1f2b21ed-5121-4c0e-8ae4-138aa2f5d726,quiz,Komponen mana yang berputar karena aliran air?,Q02,0.0,Dipilih: Panel surya | Benar: Turbine,20,New Visitor,Turbine berputar karena aliran air.
2026-03-02T19:54:03.831067,1f2b21ed-5121-4c0e-8ae4-138aa2f5d726,quiz,Apa fungsi generator dalam mini hydropower?,Q03,0.0,Dipilih: Untuk meningkatkan laju aliran | Benar: Untuk mengubah energi mekanik menjadi listrik,20,New Visitor,Generator mengubah energi mekanik dari turbin menjadi energi listrik.
2026-03-02T19:54:06.626636,1f2b21ed-5121-4c0e-8ae4-138aa2f5d726,quiz,Faktor mana yang paling mempengaruhi output mini hydropower?,Q04,1.0,Dipilih: Laju aliran | Benar: Laju aliran,40,Explorer Beginner,Laju aliran adalah salah satu faktor utama yang mempengaruhi output daya mini hydropower.
2026-03-02T19:54:09.429585,1f2b21ed-5121-4c0e-8ae4-138aa2f5d726,quiz,Mengapa mini hydropower dianggap energi terbarukan?,Q05,0.0,Dipilih: Karena menggunakan baterai | Benar: Karena menggunakan air mengalir,40,Explorer Beginner,"Mini hydropower dianggap energi terbarukan karena menggunakan air yang terus mengalir, yang merupakan sumber daya yang tidak habis."
2026-03-02T19:54:12.759622,1f2b21ed-5121-4c0e-8ae4-138aa2f5d726,quiz,Apa yang harus dilakukan pengunjung di dekat peralatan teknis?,Q06,0.0,Dipilih: Sentuh semua bagian untuk belajar lebih cepat | Benar: Tetap jauh kecuali diizinkan,40,Explorer Beginner,Pengunjung harus menjaga jarak aman dari peralatan teknis kecuali diizinkan oleh staf.
2026-03-02T19:54:15.362062,1f2b21ed-5121-4c0e-8ae4-138aa2f5d726,quiz,Mini hydropower biasanya dirancang untuk ...,Q07,0.0,Dipilih: Pengiriman laut | Benar: Kebutuhan listrik lokal atau skala kecil,40,Explorer Beginner,Mini hydropower biasanya digunakan untuk pembangkit listrik lokal atau skala kecil.
2026-03-02T19:54:17.831962,1f2b21ed-5121-4c0e-8ae4-138aa2f5d726,quiz,Apa yang membuat situs wisata ini edukatif?,Q08,0.0,Dipilih: Tidak memiliki informasi sama sekali | Benar: Menggabungkan alam dengan pembelajaran mini hydropower,40,Explorer Beginner,Situs ini mendukung pembelajaran karena pengunjung dapat melihat konsep energi terbarukan dalam lingkungan alami yang nyata.
2026-03-02T19:54:20.420730,1f2b21ed-5121-4c0e-8ae4-138aa2f5d726,quiz,Apa salah satu manfaat gamifikasi dalam chatbot ini?,Q09,1.0,Dipilih: dapat meningkatkan keterlibatan dan motivasi | Benar: dapat meningkatkan keterlibatan dan motivasi,60,Energy Explorer,"Nilai, lencana, dan kuis membantu menjaga keterlibatan dan minat pengguna dalam belajar."
2026-03-02T19:54:23.954601,1f2b21ed-5121-4c0e-8ae4-138aa2f5d726,quiz,Bagaimana pengunjung dapat membantu melindungi situs wisata?,Q10,0.0,Dipilih: Dengan membuang sampah sembarangan | Benar: Dengan menjaga kebersihan dan mengikuti aturan,60,Energy Explorer,Perilaku pengunjung yang bertanggung jawab membantu melindungi lingkungan dan fasilitas pembelajaran.
2026-03-02T19:54:26.584899,1f2b21ed-5121-4c0e-8ae4-138aa2f5d726,quiz,Energi air dalam mini hydropower pertama-tama diubah menjadi energi apa?,Q11,0.0,Dipilih: Energi nuklir | Benar: Energi mekanik,60,Energy Explorer,Aliran air memutar turbin sehingga menghasilkan energi mekanik sebelum diubah menjadi listrik oleh generator.
2026-03-02T19:54:33.940102,1f2b21ed-5121-4c0e-8ae4-138aa2f5d726,quiz,Apa peran turbin dalam sistem mini hydropower?,Q12,0.0,Dipilih: Mengalirkan kabel listrik | Benar: Mengubah energi air menjadi energi mekanik,60,Energy Explorer,Turbin berfungsi mengubah energi kinetik dari air yang mengalir menjadi energi mekanik berupa putaran.
2026-03-02T19:54:38.238818,1f2b21ed-5121-4c0e-8ae4-138aa2f5d726,quiz,Mengapa aliran air yang stabil penting dalam mini hydropower?,Q13,0.0,Dipilih: Agar wisatawan lebih banyak | Benar: Agar listrik yang dihasilkan stabil,60,Energy Explorer,Aliran air yang stabil membantu menghasilkan listrik yang stabil dan konsisten.
2026-03-02T19:54:43.248070,1f2b21ed-5121-4c0e-8ae4-138aa2f5d726,quiz,Mini hydropower termasuk dalam kategori energi ...,Q14,1.0,Dipilih: Terbarukan | Benar: Terbarukan,80,Energy Explorer,Mini hydropower termasuk energi terbarukan karena memanfaatkan sumber daya air yang terus diperbarui secara alami.
2026-03-02T19:54:46.753305,1f2b21ed-5121-4c0e-8ae4-138aa2f5d726,quiz,Apa manfaat edukatif dari melihat sistem mini hydropower secara langsung?,Q15,0.0,Dipilih: Hanya untuk hiburan | Benar: Memahami konsep energi terbarukan secara nyata,80,Energy Explorer,Melihat langsung sistem MHP membantu pengunjung memahami konsep energi terbarukan secara lebih konkret.
2026-03-02T19:54:49.476792,1f2b21ed-5121-4c0e-8ae4-138aa2f5d726,quiz,"Dalam chatbot edukasi, kuis digunakan untuk ...",Q16,0.0,Dipilih: Menghapus skor | Benar: Mengukur pemahaman pengguna,80,Energy Explorer,Kuis dalam chatbot membantu mengukur sejauh mana pengguna memahami materi yang diberikan.
2026-03-02T19:54:52.430091,1f2b21ed-5121-4c0e-8ae4-138aa2f5d726,quiz,Apa tujuan pemberian poin dalam sistem gamifikasi?,Q17,1.0,Dipilih: Meningkatkan motivasi belajar | Benar: Meningkatkan motivasi belajar,100,Mini Hydropower Ambassador,Poin diberikan untuk meningkatkan motivasi dan keterlibatan pengguna dalam proses pembelajaran.
2026-03-02T19:54:55.888310,1f2b21ed-5121-4c0e-8ae4-138aa2f5d726,quiz,Apa yang terjadi jika laju aliran air meningkat?,Q18,1.0,Dipilih: Potensi daya yang dihasilkan meningkat | Benar: Potensi daya yang dihasilkan meningkat,120,Mini Hydropower Ambassador,"Semakin besar laju aliran air, semakin besar potensi energi yang dapat dihasilkan."
2026-03-02T19:54:58.789630,1f2b21ed-5121-4c0e-8ae4-138aa2f5d726,quiz,Mengapa mini hydropower cocok untuk desa wisata?,Q19,0.0,Dipilih: Membutuhkan bahan bakar mahal | Benar: Skalanya kecil dan ramah lingkungan,120,Mini Hydropower Ambassador,"Mini hydropower cocok untuk desa wisata karena skalanya kecil, ramah lingkungan, dan sesuai untuk kebutuhan lokal."
2026-03-02T19:55:02.106527,1f2b21ed-5121-4c0e-8ae4-138aa2f5d726,quiz,Apa tujuan utama dari wisata edukasi mini hydropower?,Q20,0.0,Dipilih: Hanya menghasilkan listrik | Benar: Meningkatkan pemahaman tentang energi terbarukan,120,Mini Hydropower Ambassador,Wisata edukasi bertujuan untuk meningkatkan kesadaran dan pemahaman tentang energi terbarukan melalui pengalaman langsung.
2026-03-02T19:55:17.040436,1f2b21ed-5121-4c0e-8ae4-138aa2f5d726,chat,Apa itu PLTMH,M001,0.6257,MMini hydropower adalah sistem pembangkit listrik skala kecil yang memanfaatkan aliran air untuk menghasilkan listrik.,130,Mini Hydropower Ambassador,similarity
2026-03-19T11:51:30.715896,d1b4b6fa-7187-43b5-90eb-c57c6649ebeb,chat,jkfhkasfas,,0.0,"Maaf, saya tidak dapat menemukan jawaban yang sesuai. Silakan coba kata kunci lain seperti jam buka, fasilitas, PLTMH, turbin, generator, atau kuis.",0,New Visitor,fallback
2026-03-19T11:51:34.004867,d1b4b6fa-7187-43b5-90eb-c57c6649ebeb,chat,skjfs,,0.0,"Maaf, saya tidak dapat menemukan jawaban yang sesuai. Silakan coba kata kunci lain seperti jam buka, fasilitas, PLTMH, turbin, generator, atau kuis.",0,New Visitor,fallback
2026-03-19T11:51:34.422855,d1b4b6fa-7187-43b5-90eb-c57c6649ebeb,chat,asf,,0.0,"Maaf, saya tidak dapat menemukan jawaban yang sesuai. Silakan coba kata kunci lain seperti jam buka, fasilitas, PLTMH, turbin, generator, atau kuis.",0,New Visitor,fallback
2026-03-19T11:51:34.622919,d1b4b6fa-7187-43b5-90eb-c57c6649ebeb,chat,as,,0.0,"Maaf, saya tidak dapat menemukan jawaban yang sesuai. Silakan coba kata kunci lain seperti jam buka, fasilitas, PLTMH, turbin, generator, atau kuis.",0,New Visitor,fallback
2026-03-19T11:51:34.777983,d1b4b6fa-7187-43b5-90eb-c57c6649ebeb,chat,fsa,,0.0,"Maaf, saya tidak dapat menemukan jawaban yang sesuai. Silakan coba kata kunci lain seperti jam buka, fasilitas, PLTMH, turbin, generator, atau kuis.",0,New Visitor,fallback
2026-03-19T13:05:21.906148,5de5a2ed-cf7e-487d-8b34-ff6f4ac01269,chat,plthm,,0.0,"Maaf, saya tidak dapat menemukan jawaban yang sesuai. Silakan coba kata kunci lain seperti jam buka, fasilitas, PLTMH, turbin, generator, atau kuis.",0,New Visitor,fallback
2026-03-19T13:05:23.184166,5de5a2ed-cf7e-487d-8b34-ff6f4ac01269,chat,ashdas,,0.0,"Maaf, saya tidak dapat menemukan jawaban yang sesuai. Silakan coba kata kunci lain seperti jam buka, fasilitas, PLTMH, turbin, generator, atau kuis.",0,New Visitor,fallback
2026-03-19T13:05:23.517299,5de5a2ed-cf7e-487d-8b34-ff6f4ac01269,chat,saf,,0.0,"Maaf, saya tidak dapat menemukan jawaban yang sesuai. Silakan coba kata kunci lain seperti jam buka, fasilitas, PLTMH, turbin, generator, atau kuis.",0,New Visitor,fallback
2026-03-19T13:05:23.659836,5de5a2ed-cf7e-487d-8b34-ff6f4ac01269,chat,as,,0.0,"Maaf, saya tidak dapat menemukan jawaban yang sesuai. Silakan coba kata kunci lain seperti jam buka, fasilitas, PLTMH, turbin, generator, atau kuis.",0,New Visitor,fallback
2026-03-19T13:05:23.884913,5de5a2ed-cf7e-487d-8b34-ff6f4ac01269,chat,das,,0.0,"Maaf, saya tidak dapat menemukan jawaban yang sesuai. Silakan coba kata kunci lain seperti jam buka, fasilitas, PLTMH, turbin, generator, atau kuis.",0,New Visitor,fallback
2026-03-19T13:05:24.050030,5de5a2ed-cf7e-487d-8b34-ff6f4ac01269,chat,das,,0.0,"Maaf, saya tidak dapat menemukan jawaban yang sesuai. Silakan coba kata kunci lain seperti jam buka, fasilitas, PLTMH, turbin, generator, atau kuis.",0,New Visitor,fallback
2026-03-19T13:16:38.143651,628e17f5-9bf2-4df6-9327-7bea475b2345,chat,akshdaodsahsafahsah,,0.0,"Maaf, saya tidak dapat menemukan jawaban yang sesuai. Silakan coba kata kunci lain seperti jam buka, fasilitas, PLTMH, turbin, generator, atau kuis.",0,New Visitor,fallback
2026-03-19T14:15:55.768803,6835c72b-3c81-439f-b63a-13be1442c9dd,quiz,Apa sumber energi utama dalam mini hydropower?,Q01,0.0,Dipilih: Biomassa | Benar: Air mengalir,0,New Visitor,Mini hydropower menggunakan energi dari air yang mengalir untuk menghasilkan listrik.
2026-03-19T14:15:57.000424,6835c72b-3c81-439f-b63a-13be1442c9dd,quiz,Komponen mana yang berputar karena aliran air?,Q02,0.0,Dipilih: Panel surya | Benar: Turbine,0,New Visitor,Turbine berputar karena aliran air.
2026-03-19T14:15:58.090059,6835c72b-3c81-439f-b63a-13be1442c9dd,quiz,Apa fungsi generator dalam mini hydropower?,Q03,0.0,Dipilih: Untuk meningkatkan laju aliran | Benar: Untuk mengubah energi mekanik menjadi listrik,0,New Visitor,Generator mengubah energi mekanik dari turbin menjadi energi listrik.
2026-03-19T14:15:59.029465,6835c72b-3c81-439f-b63a-13be1442c9dd,quiz,Faktor mana yang paling mempengaruhi output mini hydropower?,Q04,0.0,Dipilih: Bentuk awan | Benar: Laju aliran,0,New Visitor,Laju aliran adalah salah satu faktor utama yang mempengaruhi output daya mini hydropower.
2026-03-19T14:15:59.980867,6835c72b-3c81-439f-b63a-13be1442c9dd,quiz,Mengapa mini hydropower dianggap energi terbarukan?,Q05,1.0,Dipilih: Karena menggunakan air mengalir | Benar: Karena menggunakan air mengalir,20,New Visitor,"Mini hydropower dianggap energi terbarukan karena menggunakan air yang terus mengalir, yang merupakan sumber daya yang tidak habis."
2026-03-19T14:16:01.283050,6835c72b-3c81-439f-b63a-13be1442c9dd,quiz,Apa yang harus dilakukan pengunjung di dekat peralatan teknis?,Q06,0.0,Dipilih: Duduk di peralatan | Benar: Tetap jauh kecuali diizinkan,20,New Visitor,Pengunjung harus menjaga jarak aman dari peralatan teknis kecuali diizinkan oleh staf.
2026-03-19T14:16:02.360197,6835c72b-3c81-439f-b63a-13be1442c9dd,quiz,Mini hydropower biasanya dirancang untuk ...,Q07,0.0,Dipilih: Pesawat terbang | Benar: Kebutuhan listrik lokal atau skala kecil,20,New Visitor,Mini hydropower biasanya digunakan untuk pembangkit listrik lokal atau skala kecil.
2026-03-19T14:16:03.338274,6835c72b-3c81-439f-b63a-13be1442c9dd,quiz,Apa yang membuat situs wisata ini edukatif?,Q08,0.0,Dipilih: Berada di dalam ruangan | Benar: Menggabungkan alam dengan pembelajaran mini hydropower,20,New Visitor,Situs ini mendukung pembelajaran karena pengunjung dapat melihat konsep energi terbarukan dalam lingkungan alami yang nyata.
2026-03-19T14:16:04.574647,6835c72b-3c81-439f-b63a-13be1442c9dd,quiz,Apa salah satu manfaat gamifikasi dalam chatbot ini?,Q09,0.0,Dipilih: itu menghapus semua konten pembelajaran | Benar: dapat meningkatkan keterlibatan dan motivasi,20,New Visitor,"Nilai, lencana, dan kuis membantu menjaga keterlibatan dan minat pengguna dalam belajar."
2026-03-19T14:16:05.473455,6835c72b-3c81-439f-b63a-13be1442c9dd,quiz,Bagaimana pengunjung dapat membantu melindungi situs wisata?,Q10,1.0,Dipilih: Dengan menjaga kebersihan dan mengikuti aturan | Benar: Dengan menjaga kebersihan dan mengikuti aturan,40,Explorer Beginner,Perilaku pengunjung yang bertanggung jawab membantu melindungi lingkungan dan fasilitas pembelajaran.
2026-03-19T14:16:06.420349,6835c72b-3c81-439f-b63a-13be1442c9dd,quiz,Energi air dalam mini hydropower pertama-tama diubah menjadi energi apa?,Q11,0.0,Dipilih: Energi nuklir | Benar: Energi mekanik,40,Explorer Beginner,Aliran air memutar turbin sehingga menghasilkan energi mekanik sebelum diubah menjadi listrik oleh generator.
2026-03-19T14:16:07.759497,6835c72b-3c81-439f-b63a-13be1442c9dd,quiz,Apa peran turbin dalam sistem mini hydropower?,Q12,0.0,Dipilih: Mengatur suhu air | Benar: Mengubah energi air menjadi energi mekanik,40,Explorer Beginner,Turbin berfungsi mengubah energi kinetik dari air yang mengalir menjadi energi mekanik berupa putaran.
2026-03-19T14:16:08.543262,6835c72b-3c81-439f-b63a-13be1442c9dd,quiz,Mengapa aliran air yang stabil penting dalam mini hydropower?,Q13,0.0,Dipilih: Agar kolam lebih dalam | Benar: Agar listrik yang dihasilkan stabil,40,Explorer Beginner,Aliran air yang stabil membantu menghasilkan listrik yang stabil dan konsisten.
